<?xml version="1.0" encoding="UTF-8" ?>

<Students xmlns:xs="http://www.w3.org/2001/XMLSchema-instance"
          xmlns="http://www.students.com"
          xs:schemaLocation="http://www.students.com input.xsd">
    <Student>
        <firstName>Barack</firstName>
        <lastName>Obama</lastName>
        <age>18</age>
        <country>USA</country>
        <phoneNumber>03425234</phoneNumber>
        <params>
            <height>184.3</height>
            <weight>98.3</weight>
            <colour>black</colour>
        </params>
    </Student>
    <Student>
        <firstName>Jorge</firstName>
        <lastName>Bush</lastName>
        <age>22</age>
        <country>USA</country>
        <phoneNumber>03422222</phoneNumber>
        <params>
            <height>174.3</height>
            <weight>88.0</weight>
            <colour>white</colour>
        </params>
    </Student>
    <Student>
        <firstName>Pablo</firstName>
        <lastName>Escobar</lastName>
        <age>22</age>
        <country>Columbia</country>
        <phoneNumber>124324235</phoneNumber>
        <params>
            <height>180.2</height>
            <weight>99.0</weight>
            <colour>white</colour>
        </params>
    </Student>
    <Student>
        <firstName>Cathrine</firstName>
        <lastName>Smith</lastName>
        <age>20</age>
        <country>France</country>
        <phoneNumber>2332234</phoneNumber>
        <params>
            <height>160.3</height>
            <weight>55.0</weight>
            <colour>white</colour>
        </params>
    </Student>
    <Student>
        <firstName>Anna</firstName>
        <lastName>Kravchuk</lastName>
        <age>19</age>
        <country>Ukraine</country>
        <phoneNumber>05868383</phoneNumber>
        <params>
            <height>176.4</height>
            <weight>60.1</weight>
            <colour>white</colour>
        </params>
    </Student>
</Students>